{
  "ver": 1,
  "iss": "https://cloud.automata.example",
  "sub": "11111111-1111-4111-8111-111111111111",
  "aud": "prod-us-east-1-001",
  "workspace_id": "22222222-2222-4222-8222-222222222222",
  "session_id": "33333333-3333-4333-8333-333333333333",
  "auth_time": 1786500000,
  "iat": 1786500060,
  "exp": 1786500180,
  "jti": "44444444-4444-4444-8444-444444444444"
}
